prNumber,Util,NLP,APM,Network,DB,Interpreter,Error Handling,Logging,Lang,Data Structure,DevOps,i18n,Setup,Logic,Microservices,ML,Test,Search,IO,UI,Parser,Security,Cloud,Big Data,Event Handling,App,GIS,prTitle,prBody,prIssue,issueNumber,issueTitle,issueBody,prComments,issueTitleLink,issueBodyLink,issue_Comments,isPR,isTrain,commitMessage,prCodeReviewComments,Multi Thread,Multimedia,CG,OS
491,1.0,0.0,0.0,0.0,0.0,0.0,0.0,1.0,0.0,0.0,0.0,0.0,0.0,1.0,0.0,0.0,0.0,0.0,1.0,1.0,0.0,0.0,0.0,0.0,0.0,0.0,0.0,add close all/others/ in database tab menu,see #314,,314,add close all/others/ in database tab menu,see #314,|| changelog is missing otherwise :+1:,add close all/others/ in database tab menu/file menu,similar to ides so i can close all open databases at once and continue working on a new or only one database,|| :+1: :sunglasses:  || continue discussion in pr #491,1.0,0.0,remove impossible todo,|| nice fixme any idea what this could mean here? || nope i forgot what it meant :smile:  || maybe it is even fixed by calling this method and i added the fixme because we must make sure that this is called every time we remove something i dont know || what about this todo? || can be removed as this doesnt work with our current impl,0,0,0,0
677,1.0,0.0,0.0,0.0,1.0,0.0,0.0,1.0,0.0,0.0,0.0,0.0,0.0,1.0,0.0,0.0,0.0,0.0,1.0,1.0,0.0,0.0,0.0,0.0,0.0,0.0,0.0,make bibtex parser more robust against missing newlines,as described in #669 and #621 the parser has some problems when an entry (or preamble) follows directly the file encoding header (on the same line)  i.e.   % encoding: myencoding @article{} . actually  as the tests reveal it was not a problem with the actual parser but within the file opening logic.  i don t view this pr as a complete fix for #669 and #621 since not just the parser but also the serialization should be improved.  also fix a bug that prevented the import of bibtex entries having only a key as its content.,,669,make bibtex parser more robust against missing newlines,as described in #669 and #621 the parser has some problems when an entry (or preamble) follows directly the file encoding header (on the same line) ie `% encoding: myencoding @article{}`actually as the tests reveal it was not a problem with the actual parser but within the file opening logic i dont view this pr as a complete fix for #669 and #621 since not just the parser but also the serialization should be improvedalso fix a bug that prevented the import of bibtex entries having only a key as its content,|| :+1: (except my minor comment) || corrected for some reason the code style was not imported correctly in intellij || hm i just use the default intellij code style :) || @tobiasdiez: what do you think should be done to fix the above issues completely? || @lenhard in my opinion jabref should add new lines after the encoding and preamble im working on a solution right now (including a bit of refactoring to make testing easier) || @tobiasdiez ok good to hear! ill concentrate on other issues then,jabref 31/32 writes bib file in a format that it will not read,if the @preamble field is present jabref 31/32 omits the newline between that line and the preceding encoding line when saving the file the resulting file is not readable by jabref sample attached problem seems to have been introduced at v31[testtxt](https://githubcom/jabref/jabref/files/89065/testtxt),|| related #621 || @tobiasdiez is this fixed? || @stefan-kolb it will be fixed with #718  || too late in the evening should have seen that myself :smile: :+1:,1.0,0.0,minor code reformatting,|| please always use curly braces as this makes the semantics explicit,0,0,0,0
734,1.0,0.0,0.0,0.0,0.0,1.0,0.0,1.0,0.0,0.0,0.0,0.0,0.0,1.0,1.0,0.0,0.0,0.0,1.0,1.0,0.0,0.0,0.0,0.0,0.0,0.0,0.0, add an optional tab that shows fields that are not displayed inside t…,…he predefined tabs #454,,454, add an optional tab that shows fields that are not displayed inside t…,…he predefined tabs #454,,entry editor: tab for remaining fields,at the moment each bibtexentry has required and optional fields the remaining fields can only be seen in the source tab of the entry editor we should add a tab to the entry editor which shows all the remaining fields and provide the ability to change them this is a good task to start developing for jabref,,1.0,0.0,resolve conflicts,,0,0,0,0
915,1.0,0.0,0.0,1.0,0.0,0.0,0.0,1.0,0.0,0.0,0.0,0.0,0.0,1.0,0.0,0.0,0.0,0.0,1.0,1.0,0.0,0.0,0.0,0.0,0.0,0.0,0.0,add button in preference dialog to reset preferences,implements #455 and/or  -  ? -   -  ? - only ui change -  ?,,455,add button in preference dialog to reset preferences,implements #455 and/or   change in changelogmd described?-  ? ( )-  ? - only ui change-  ?,|| nice looks good but i would add a note that resetting the perferences requires a restart (see change the language or the remote settings)  || good point an info message is now shown || looks good to me,reset preference or tool for clear jabref registry,i noticed that when i use different versions of jabref some times they load different files this means that different versions read perhaps different registry keys or the jabref preference are saved in different registry locationson the same machine the 3x version preference is different to 2x version perhaps ive tested too many versions ?is there an option to reset jabref preference ?or perhaps it would be better a tool which deletes all previous jabref registries,|| you can reset the preferences by starting jabref with `java -jar jabref-211jar --prdef all -n` || we dont really need two issues in different repositories for the very same thing do we? is enough,1.0,0.0,add button in preference dialog to reset preferencesimplements #455 and/or [kopper47](https://githubcom/koppor/jabref/issues/47),,0,0,0,0
925,1.0,0.0,0.0,1.0,0.0,0.0,0.0,0.0,0.0,0.0,0.0,0.0,0.0,1.0,0.0,0.0,1.0,0.0,1.0,0.0,0.0,0.0,0.0,0.0,0.0,1.0,0.0,add tests for metadata parsing,this solves #707 and prepares the way to refactor the metadata class.  i added a few methods to the metadata class to make testing more convenient. many calls to getdata() in fact can be replaced by these new methods. i think this is something for a new pr.  one question: to write the tests in a nice way i had to overwrite a few equals methods. in particular for the lowercasechanger. should i also override equals for all other formatters?,,707,add tests for metadata parsing,this solves #707 and prepares the way to refactor the metadata classi added a few methods to the metadata class to make testing more convenient many calls to getdata() in fact can be replaced by these new methods i think this is something for a new prone question: to write the tests in a nice way i had to overwrite a few equals methods in particular for the lowercasechanger should i also override equals for all other formatters?,|| :+1:  || when is the equals required (except for simplifying this test)? seems like one can add them later if requiredthe pr looks good! || no as far as i can see equals is never used for the formatters (and also no getkey()equals which could be replaced with an internal equals),add tests checking parsing of jabrefs metadata (groups etc),we should add tests to `bibtexparsertest` to make sure that we do not break the meta data format,|| seems like this issue has already been fixed 8 months ago high time for closing,1.0,0.0,add tests for metadata parsingthis solves #707,,0,0,0,0
937,1.0,0.0,0.0,0.0,0.0,1.0,0.0,1.0,0.0,0.0,0.0,0.0,0.0,1.0,0.0,0.0,0.0,0.0,1.0,1.0,0.0,0.0,0.0,0.0,0.0,0.0,0.0,preview panel is now updated when an entry is cut/deleted,936. when an entry is cut/deleted the preview panel will be hidden due to the fact that no entry is selected anymore. -  ? -   -  ? -  ?,,936,preview panel is now updated when an entry is cut/deleted,936when an entry is cut/deleted the preview panel will be hidden due to the fact that no entry is selected anymore-  change in changelogmd described?-  ? ( )-  ?-  ?,|| looks good :+1: || :+1:  || :+1:  || does the panel show up again when selecting another entry after deleting one? if so :+1:  || yes it does || we really should consider to implement an event system || :+1: for the event system (maybe use the stuff that comes with google guava,preview panel is not updated when an entry is cut/deleted,when an entry is cut or deleted the preview panel is not updatedtested with the current master at 7aa371c931ea51e7c092632e3e3f817c4861f66b![notupdated](https://cloudentcom/assets/15333371/13703378/f48015de-e795-11e5-94f3-e130f76353b8gif),|| nice video :smile: for reproducing the issue!,1.0,0.0,936,,0,0,0,0
1014,1.0,0.0,0.0,1.0,0.0,1.0,0.0,1.0,0.0,0.0,0.0,0.0,0.0,1.0,0.0,0.0,1.0,0.0,1.0,1.0,0.0,0.0,0.0,0.0,0.0,1.0,0.0,improved exception handling in tests cases,never catch an exception removed unnecessary exceptions throw specific exceptions  never only exception ref #1012  -   -  ? -  ?,,1012,improved exception handling in tests cases,never catch an exceptionremoved unnecessary exceptionsthrow specific exceptions never only exceptionref #1012 -  ? ( )-  ?-  ?,|| good work! :+1: || @siedlerchr btw you should assign your commit email with your github account see  || @oscargus fixed@stefan-kolb i just added my git mail address to my github account as secondary mail address || was done by eclipse will change this back,dont catch exceptions in unit test,some unit tests catch exceptions and then call a method called fail()that has the nasty disadvantage that the stacktrace and the real exception is hidden,|| i just added a corresponding point to the wiki  || i am just going through the tests to check em,1.0,0.0,improved exception handling in tests caesnever catch an exceptionremosed unnecessary exceptionsthrow speficic exceptions never only exception,|| assign directly || indentation,0,0,0,0
1041,1.0,0.0,0.0,0.0,0.0,0.0,0.0,0.0,0.0,0.0,0.0,0.0,0.0,1.0,0.0,0.0,1.0,0.0,1.0,0.0,0.0,0.0,0.0,0.0,0.0,1.0,0.0,write database type in lower case into the bib file,this finally 963. a quick fix has been introduced in 661eea007e555  but that does not cover the lower case writing of the type.      @comment{jabref-meta: database_type:bibtex }      finally gets      @comment{jabref-meta: databasetype:bibtex }     -   -> this has been introduced in the development versions after the last release  thus no entry required -   -> tests have been adapted to match this new implementation,,963,write database type in lower case into the bib file,this finally 963 a quick fix has been introduced in 661eea007e555 but that does not cover the lower case writing of the type```@comment{jabref-meta: database_type:bibtex}```finally gets```@comment{jabref-meta: databasetype:bibtex}```-  change in changelogmd described -> this has been introduced in the development versions after the last release thus no entry required-   -> tests have been adapted to match this new implementation,|| is the parsing case insensitive? is that tested? || @oscargus the value is parsed case-insensitive,nicer serialization of database bibtex mode,if i switch to bibtex mode jabref writes```@comment{jabref-meta: database_type:bibtex}```biblatex mode is```@comment{jabref-meta: database_type:biblatex}```proposal: no use of uppercase letters```@comment{jabref-meta: databasetype:bibtex}@comment{jabref-meta: databasetype:biblatex}```reason: consistency with other metadata see  know that we both have camelcase and usage of dashes and underscores the jabcon addition by jörg (`saveorderconfig`) used the camelcase and we should not introduce other serialization kinds should we?,|| you keep `bibtex` and `biblatex` (instead of `bibtex` and `biblatex`) because of  :innocent:,1.0,0.0,fix integrity check tests,,0,0,0,0
1056,1.0,0.0,0.0,0.0,0.0,1.0,0.0,1.0,0.0,0.0,0.0,0.0,0.0,1.0,0.0,0.0,0.0,0.0,1.0,1.0,0.0,0.0,0.0,0.0,0.0,0.0,0.0,fixes npe in export to external db,fixes npe in export to external db add db type to export succesful message reformatting #1055  no changelog because i think it was new introduced by the redesign of the entry sorting (passing null),,1055,fixes npe in export to external db,fixes npe in export to external dbadd db type to export succesful messagereformatting#1055no changelog because i think it was new introduced by the redesign of the entry sorting (passing null),|| export now all entries by default,npe in getsortedentries when exporting to external db,jabref 33 dev master commit: ed989b069b768390240fd4a2946b9f4b13142cdcreproducablesteps to reproduce:1 open export to external sql database2 choose mysql (doesnt matter)3 fill in the conn details   4  select target db/create new one4 enter name 5 click oknpe is shown:```18:53:07518 [spin-0] info  netsfjabrefguibasepanel - could not export to sql databasejavalangnullpointerexception    at javautilobjectsrequirenonnull(unknown source) ~[?:180_74]    at netsfjabrefexporterbibdatabasewritergetsortedentries(bibdatabasewriterjava:85) ~[bin/:?]    at netsfjabrefsqlexporterdbexporterperformexport(dbexporterjava:86) ~[bin/:?]    at netsfjabrefsqlexporterdbexporterexportdatabasetodbms(dbexporterjava:430) ~[bin/:?]    at netsfjabrefguibasepanel$1run(basepaneljava:544) [bin/:?]    at sunreflectnativemethodaccessorimplinvoke0(native method) ~[?:180_74]```,|| i am looking into that seems like i found the problem || yes someone still passes `null` to the entries argument which was the old version to indicate that all entries should be sorted  || @tobiasdiez  yep there is missing a getselectedentries() as parameter || hmm i thought that i (ie eclipse) had found all performexport calls but obviously not,1.0,0.0,fixes npe in export to external dbexport all entries by defaultadd db type to export succesful messagereformatting#1055,|| should really only the selected entries be exported or all (getdatabase()getentries)? previously `null` indicated the latter  || okay then i think i take better all entries to be consistent,0,0,0,0
1168,1.0,0.0,0.0,1.0,0.0,0.0,0.0,1.0,0.0,0.0,0.0,0.0,0.0,1.0,0.0,0.0,0.0,0.0,0.0,1.0,0.0,0.0,0.0,0.0,0.0,0.0,0.0,1163 by removing the strange functionality which enabled sorting…,we have some very strange logic in jabref which allows to handle years using only the two last numbers  so we can detect that 68 means 1968. this causes a lot of issues. i do not think that jabref should still support such strange logic  and just use the value which is in the year field.   hence  i removed it.   this also solves the issue of having that yearutil in the model package which duplicated a method in the stringutil class.   refs #1163,,1163,1163 by removing the strange functionality which enabled sorting…,we have some very strange logic in jabref which allows to handle years using only the two last numbers so we can detect that 68 means 1968 this causes a lot of issues i do not think that jabref should still support such strange logic and just use the value which is in the year field hence i removed it this also solves the issue of having that yearutil in the model package which duplicated a method in the stringutil class refs #1163,|| lgtm :+1: || lgtm :+1:  || should we readd yearutil as a cleanup to convert two digit years to four digit years? || if we add it we should make use of the java 8 functionality instead of the own ugly parsing: this one:http://stackoverflowcom/questions/29490893/parsing-string-to-local-date-doesnt-use-desired-century,year sorting doesnt work,clicking on the year column doesnt affect the sorting of the table,,1.0,0.0,1163 by removing the strange functionality which enabled sorting of two-digit years as well,,0,0,0,0
1192,1.0,0.0,0.0,0.0,0.0,1.0,0.0,1.0,0.0,0.0,0.0,0.0,0.0,1.0,0.0,0.0,0.0,0.0,1.0,1.0,0.0,0.0,0.0,0.0,0.0,0.0,0.0,preview panel is now updated when an entry is cut/deleted (again),when i fixed #936 some time ago (pr: #937) i made a tiny error.  the issue was to hide the preview panel when deleting/cutting an entry  but it also hid it when aborting the delete-confirmation-dialog. i too refactored both actions a little to make it easier for future changes.  i also removed in  undoableremoveentry  and  undoableinsertentry  the id generation.,,936,preview panel is now updated when an entry is cut/deleted (again),when i fixed #936 some time ago (pr: #937) i made a tiny errorthe issue was to hide the preview panel when deleting/cutting an entry but it also hid it when aborting the delete-confirmation-dialogi too refactored both actions a little to make it easier for future changesi also removed in `undoableremoveentry` and `undoableinsertentry` the id generation,,preview panel is not updated when an entry is cut/deleted,when an entry is cut or deleted the preview panel is not updatedtested with the current master at 7aa371c931ea51e7c092632e3e3f817c4861f66b![notupdated](https://cloudentcom/assets/15333371/13703378/f48015de-e795-11e5-94f3-e130f76353b8gif),|| nice video :smile: for reproducing the issue!,1.0,0.0,fix 936 (again) and some refactoringremoving new id generation because its not necessary,,0,0,0,0
1229,1.0,0.0,0.0,1.0,0.0,1.0,0.0,1.0,0.0,0.0,0.0,0.0,0.0,1.0,0.0,0.0,0.0,0.0,1.0,1.0,0.0,0.0,0.0,0.0,0.0,0.0,0.0,1091 apply and ensure correct import sort order,see #1091,,1091,1091 apply and ensure correct import sort order,see #1091,|| :+1: || lgtm :+1:,structure of imports,as discovered in #1089 there might be a problem with intellij restructuring the imports vs how eclipse does it i just run into the same problem with #1090 so i would like to discuss here what the correct preferences for intellij are the following settings produce a somewhat satisfying result but there are still quite a few difference to some imports in some files![untitled](https://cloudentcom/assets/5037600/14232775/2cbbfa04-f9b5-11e5-80ee-4f9743df5431png),|| i just posted this at the pr:maybe you could evaluate that: || we need something like checkstyle which enforces it using gradle we should maybe activate checkstyle for this making the build fail if the imports are not in order  || i looked through some of the source files and have noticed that there is no clear order in which the classes are importedthus i think we firstly need to decide on a proper order (eg first jdk related imports then jabref and after that the rest with a blank line between)furthermore i prefer the fully qualified imports over the generalized ones (*) || checkstyle checks are now in place for forcing one to remove unused imports we can add additional checks eg for the import order but we should be careful not to add to much and only add additional checks as an evolution of the code base see 9e9fc8c || ( || ![image]( || in eclipse automatically generated - use `gradlew eclipse`![grabbed_20160412-143351]( || ![image]( || this is solved do we need to post the intellij configuration at  || did we document this in the wiki? || it is now added at https://githubcom/jabref/jabref/wiki/guidelines-for-setting-up-a-local-workspace#intellij,1.0,0.0,merge branch master into import-sort-order-fixed,,0,0,0,0
1298,1.0,0.0,0.0,0.0,0.0,0.0,0.0,0.0,0.0,0.0,0.0,0.0,0.0,0.0,0.0,0.0,0.0,0.0,1.0,0.0,0.0,0.0,0.0,0.0,0.0,0.0,0.0,added option to copy version information in the about dialog,added option to copy version information of jabref in the about dialog as described in #871 . this will help with filing issues and bug reports as the version of jabref  os and java will be copied.  -   -   -   ()  ![screen shot 2016-04-25 at 22 38 58](https://cloud.ent.com/assets/15340757/14798171/915a5bbc-0b36-11e6-8bbf-b01cb100b2cd.png),,871,added option to copy version information in the about dialog,added option to copy version information of jabref in the about dialog as described in #871 this will help with filing issues and bug reports as the version of jabref os and java will be copied -  change in changelogmd described-  -   ()![screen shot 2016-04-25 at 22 38 58](https://cloudentcom/assets/15340757/14798171/915a5bbc-0b36-11e6-8bbf-b01cb100b2cdpng),|| just one minor comment otherwise this looks good please rebase || ## [current coverage]( is **2749%**> merging 1298]( into [master]( will decrease coverage by **-<01%**``` diff@@             master      #1298   diff @@  files           694        696     +2     lines         46259      46419   +160     methods           0          0            messages          0          0            branches       7650       7677    +27   + hits          12755      12760     +5   - misses        32404      32555   +151   - partials       1100       1104     +4   ```1 3 files (not in diff) in `/net/sf/jabref/logic` were deleted [more]( 1 files (not in diff) in `n/java/net/sf/jabref` were deleted [more]( 2 files (not in diff) in `bref/logic/formatter` were created [more]( 2 files (not in diff) in `jabref/logic/cleanup` were created [more]( 1 files (not in diff) in `n/java/net/sf/jabref` were created [more]( 4 files (not in diff) in `f/jabref/model/entry` were modified [more](    - misses `+8`    - hits `-12`7 5 files (not in diff) in `/jabref/logic/groups` were modified [more](    - misses `+22`    - partials `+3`    - hits `-1`8 3 files (not in diff) in `jabref/logic/cleanup` were modified [more](    - misses `+6`    - hits `+8`9 3 files (not in diff) in `/net/sf/jabref/logic` were modified [more](    - misses `-2`    - partials `-2`    - hits `-2`10 3 files (not in diff) in `t/sf/jabref/importer` were modified [more](     - misses `-5`     - partials `+1`     - hits `-1`> powered by [codecov]( last updated by [7230a80941240f](https://codecovio/gh/jabref/jabref/compare/7230a809da3e138e362b56366043c4a18b267ca1941240f674c02e07a8aae88010b1c0f9dd4a3a6f),about dialog should enable copy and paste,- jabref version (available in the about box): jabref 33dev--snapshot-2016-02-26--master--20e95f9- operation system and version: windows 81- steps to reproduce:   1 open about dialogwhen filing an issue it should be easy to copy the version string![grabbed_20160226-142525](https://cloudentcom/assets/1366654/13353450/c9b8750a-dc94-11e5-8b96-d8447c5227a6png),|| additionally i note some weird characters among the author names they appear both on your screenshot and on my linux computer || the weird characters are because of [gradle-1267]( fixed by  which is not integrated yetsee also #682 || see intelij copy to clipboard link in about dialog || @boceckts could you port the copy and paste from #964 to the `master` branch (without javafx libraries)? || refs #968 (javafx) and #1298 (swing) i think its solved,1.0,0.0,added option to copy version information in the about dialog,|| why the indent here? || dont use underscores here and remove stringformat (or is this necessary?) || no its not necessary this was from a previous version and is now removed || creating this info version string along with the static variables should be moved to the buildinfo class  || i moved them into the buildinfo class and made them static,0,0,0,0
1318,1.0,0.0,0.0,0.0,0.0,0.0,0.0,0.0,0.0,0.0,0.0,0.0,0.0,0.0,0.0,0.0,1.0,0.0,1.0,0.0,0.0,0.0,0.0,0.0,0.0,0.0,0.0,update localization instructions,corrected gradlew task name #1312  @koppor  @stefan-kolb,,1312,update localization instructions,corrected gradlew task name#1312@koppor  @stefan-kolb,|| please check the order of the imports:  || hm will check my eclipse settings again || `gradlew eclipse` should be enough --> we are generating the correct settings no need for manual intervention || @koppor  fixed the import order the setting was not activated in my eclipse saving options  || ## [current coverage]( is **2751%**> merging 1318]( into [master]( will not change coverage``` diff@@             master      #1318   diff @@  files           695        695            lines         46382      46382            methods           0          0            messages          0          0            branches       7677       7677            hits          12760      12760            misses        32518      32518            partials       1104       1104          ```> powered by [codecov]( last updated by [1aa2145522607b]( || lgtm :+1:,update contributing localization information,see  use the gradle task for now,|| in my other pr  #1265   already changed the error/info text output of the consistencytest  output to the new gradle task name edit// linked wrong pr || @siedlerchr wrong pr referenced?,1.0,0.0,update localization instructionscorrected gradlew task name#1312,|| wrong indent? (also the other lines) || hm will look into that and i use gradlew eclipse || @jabref/developers can these irrelevant statements for the other languages be removed?,0,0,0,0
1388,1.0,0.0,0.0,0.0,0.0,0.0,0.0,0.0,0.0,0.0,0.0,0.0,0.0,1.0,0.0,0.0,0.0,0.0,0.0,0.0,0.0,0.0,0.0,0.0,0.0,0.0,0.0,fix sorting issue #1357,the logic is fucked but this should fix the issue.  problem was that when sort in original order was selected  the corresponding variable newsortorder would still read the disabled sort order inside the jdialog.,,135,fix sorting issue #1357,the logic is fucked but this should fix the issueproblem was that when sort in original order was selected the corresponding variable newsortorder would still read the disabled sort order inside the jdialog,,unify all paste actions,,|| could you elaborate a bit why you opened and why you closed it? im just curious :) || dont think it makes sense to do it that way we more likely need a controller-based solution for this,1.0,0.0,fix sort issue by @benni0815 #1357,,0,0,0,0
