prNumber,Util,NLP,APM,Network,DB,Interpreter,Error Handling,Logging,Lang,Data Structure,DevOps,i18n,Setup,Logic,Microservices,ML,Test,Search,IO,UI,Parser,Security,Cloud,Big Data,Event Handling,App,GIS,prTitle,prBody,prIssue,issueNumber,issueTitle,issueBody,prComments,issueTitleLink,issueBodyLink,issue_Comments,isPR,isTrain,commitMessage,prCodeReviewComments,Multi Thread,Multimedia,CG,OS
4839,1.0,0.0,0.0,1.0,0.0,0.0,0.0,1.0,0.0,0.0,0.0,0.0,0.0,1.0,0.0,0.0,0.0,0.0,1.0,0.0,0.0,0.0,0.0,0.0,0.0,0.0,0.0,fix parser exception when loading tex-groups with non-existing file,4735.  catch file not found exception and handle non existing aux files gracefully.           ( (         ----  -   -   -  -   () -  ( -   ( []()?),,4735,fix parser exception when loading tex-groups with non-existing file,4735 catch file not found exception and handle non existing aux files gracefully        ( (      because github does not support autolinking there -->-----  change in changelogmd described-  -  manually tested changed features in running jabref-   ()-  (   ( [helpjabreforg](https://githubcom/jabref/helpjabreforg/issues)?),,non-existing aux file in group throws ioexception,<!-- note: please use the github issue tracker only for bug reports feature requests questions and general feedback is now handled at  --> jabref dev version <!-- version as shown in the about box --> on windows 10 <!-- windows 10|ubuntu 1404|mac os x 108| --><!-- important note -><!--       please always test if the bug is still reproducible in the latest development version      we are constantly improving jabref and some bugs may already be fixed      you can download the development version at:       please make a backup of your library before you try out this version      if you already use a development version ensure that you use the latest one -->-  i have tested the latest development version from  and the problem persists<!-- add a clear and concise description of what the bug is -->steps to reproduce the behavior:1 create a group based on aux file2 close and save library3 remove aux file4 open library again -> get error message because of ioexception group tree is emptysolution:catch exception (and log warning) here  if applicable add excerpt of the bibliography file screenshot and excerpt of log (available in the error console) --><details>  <summary>log file</summary>    ```  paste an excerpt of your log file here  ```</details>,|| hi @tobiasdiez i would like to work on this issue || @arturolc ive now fixed this myself as i again run into this problem hope you didnt already started working on this,1.0,0.0,fix checkstyle,|| whats this making for a difference?  || its a static method so there is no reason to call it from an instance variable (btw: automatic change by intellj),0,0,0,0
4860,1.0,0.0,0.0,0.0,0.0,0.0,0.0,1.0,0.0,0.0,0.0,0.0,0.0,1.0,0.0,0.0,0.0,0.0,1.0,1.0,0.0,0.0,0.0,0.0,0.0,0.0,0.0,remove deprecated awt apple extension,3905           ( (         ----  -   -   -  -   () -  ( -   ( []()?),,3905,remove deprecated awt apple extension,3905        ( (      because github does not support autolinking there -->-----  change in changelogmd described-  -  manually tested changed features in running jabref-   ()-  (   ( [helpjabreforg](https://githubcom/jabref/helpjabreforg/issues)?),|| @linusdietz  @halirutan  could you please test if this removal breaks anything related to mac? the only thing from the code might be the file handling eg double? click on a bib file in the finder  || tested it for a day no issues appeared,apple java extensions still needed?,do they still make any sense?https://developerapplecom/legacy/library/samplecode/applejavaextensions/introduction/introhtml,|| at least with java 9 they are obsolete and with javafx no longer needed but we still have one or two dialogs who use them  || refs #3861  || so full steam ahead for the javafx migration 🎉  || refs #3421,1.0,0.0,remove mac adapter from frame,,0,0,0,0
4964,1.0,0.0,0.0,0.0,0.0,0.0,0.0,0.0,0.0,0.0,0.0,0.0,0.0,1.0,0.0,0.0,0.0,0.0,0.0,1.0,0.0,0.0,0.0,0.0,0.0,0.0,0.0,remove ui threadlist for maintable as it prevents sorting in maintable,4886  renenables sorting.  tried a bit around and could not find any side issue so far.            ( (         ----  -   -   -  -   () -  ( -   ( []()?),,4886,remove ui threadlist for maintable as it prevents sorting in maintable,4886renenables sortingtried a bit around and could not find any side issue so far        ( (      because github does not support autolinking there -->-----  change in changelogmd described-  -  manually tested changed features in running jabref-   ()-  (   ( [helpjabreforg](https://githubcom/jabref/helpjabreforg/issues)?),|| added it around the original getentries that works now as well || jabref 50-dev--snapshot--2019-05-11--master--3baa6bd22linux 4180-18-generic amd64 java 180_191yes seems to work fine  its a little slow perhaps?  jabref seems to need a up to 7 seconds to sort a newly-selected date/year column (thinkpad t560 with i5 core cpu bib database with 4000+ entries) and a few seconds after a sort to start receiving keystrokes again  alphabetic field columns sort more quicklythanks!dominik || @tobiasdiez  i didnt encounter any problems with the cleanup maybe we can remove the wrapper? seems to cost performance,the ordering of columns in the main table was disabled?,steps to reproduce the behavior:1) open a bib-file in jabref 2) click on the column headers in the main table and try to sort by any of the columns3) this functionality seems to be disabled how can i enable it again? is it a bug? (event log window is empty)jabref 50-dev--snapshot--2019-04-14--master--939cf59c2linux 507-1-default amd64 java 180_201 (build 180_201-b09),|| thanks for the report that is definitely a regression bug it was working fine a few versions ago if i remember correctlyedit// confirmed on windows 10 with 47f43ca63616f04bfa780c9a8d83143d919d1f80 tjabref 50-devwindows 10 100 amd64 java 180_202 || @tobiasdiez  i found the issue: in the maintable if i remove the bindings wrapper it works again``` thissetitems(bindingshelperforui(modelgetentriesfilteredandsorted()))        // enable sorting        modelgetentriesfilteredandsorted()comparatorproperty()bind(thiscomparatorproperty())``` || the issue is not solved in the latest snapshot of today (`2019-05-06 c168c4978`) || @siedlerchr @tobiasdiez what is the problem with this why is the correction not yet applied? it renders my working with jabref very difficult the version snapshot--2019-05-10--master--751c5b5e7 does not have sorting back || please be patient!  we understand that this is an important issue as long as the issue is not closed its not fixed no need to constantly question it  come on you know the ruleswhile the fix looks simple it might have other consequences which we need to check but i will look at it in detail now || should be fixe now in the latest master 3baa6bd we would like to ask you to use a development build from  and report back if it works for you please remember to make a backup of your library before trying-out this version || great it works! thanks,1.0,0.0,wrap around original entries,,0,0,0,0
4999,1.0,0.0,0.0,1.0,0.0,1.0,0.0,1.0,0.0,0.0,0.0,1.0,0.0,1.0,1.0,0.0,0.0,0.0,1.0,1.0,0.0,0.0,0.0,0.0,0.0,0.0,0.0,fix iee fetcher,4997   add exception dialog on import fail  check if we have keywords field present in json           ( (         ----  -   -   -  -   () -  ( -   ( []()?),,4997,fix iee fetcher,4997 add exception dialog on import failcheck if we have keywords field present in json        ( (      because github does not support autolinking there -->-----  change in changelogmd described-  -  manually tested changed features in running jabref-   ()-  (   ( [helpjabreforg](https://githubcom/jabref/helpjabreforg/issues)?),,ieexplore online fetcher not working,online fetcher not generating results problem started 3 weeks back prior to that it was working perfect in the beginning the error was shown as internet connection issue after updating the jabref with latest version the search keeps processing with no result the internet is connected with proxy hostname and authentication already given in the preferences![screen](https://user-imagesentcom/50617012/58316944-633e4280-7e32-11e9-8485-11b9bfb55537png),|| thanks for your report! this was indeed a bug in the ieee fetcher in addtion if any fetcher throws an error it will be displayed in a dialog nowwe would like to ask you to use a development build from  and report back if it works for you please remember to make a backup of your library before trying-out this version,1.0,0.0,merge branch ieefix of githubcom:jabref/jabref into ieefix* ieefix of githubcom:jabref/jabref:  fix the attach file dialog for starting on the users main directory (#4996)  readme toc (#4986)  fix icon size - the second (#4993)  fix background color of dialogs in dark mode (#4994)  npe-fix for preferences/ext-prog/settings for x/browse  (#4983)  bump richtextfx from 0100 to 0101 (#4989)  bump tika-core from 120 to 121 (#4984)  resize different fonts changing entry type (#4980)  extended hints - alternative to #4971 (#4975)  fix command line help text (#4979),|| add spaceing around `->`,0,0,0,0
5048,1.0,0.0,0.0,0.0,0.0,1.0,0.0,1.0,0.0,0.0,0.0,0.0,0.0,1.0,0.0,0.0,0.0,0.0,1.0,1.0,0.0,0.0,0.0,0.0,0.0,0.0,0.0,preserve encoding while copy and pasting in maintable,5043.  encodes and decodes data with utf-8.,,5043,preserve encoding while copy and pasting in maintable,5043encodes and decodes data with utf-8,|| merging this now!,handling of umlaut while copy and paste of entries,using `jabref 50-dev--snapshot--2019-05-30--master--ef2ebe165` on windows 10the bib-file is utf-8 encoded (double checked! with extern editor) and in biblatex style there are entries with umlauts in the abstract title etc- on entry has well formated umlauts and they are correctly displayed in jabref editor and preview window- copy such an entry (ctrl+c)- paste it (ctrl+v)- all umlauts are converted into `�`example of such a result (copied from the bib-file)```@misc{nordhausen2019c  author     {nordhausen thomas and hirt julian}  title      {one size does not fit all-systematische literaturrecherche in fachdatenbanken schritt 6: entwicklung des suchstrings}  date       {2019}  language   {ger}  doi        {106094/klinpfleg521}  abstract   {in diesem schritt werden die identifizierten synonyme und schlagw�rter entsprechend der suchkomponenten mithilfe von booleschen operatoren miteinander verkn�pft diese verkn�pfung wird als suchstring bezeichnet und muss f�r jede datenbank gesondert vorgenommen werden bei der entwicklung ist auch der einsatz von wortabstandsoperatoren und/oder platzhaltern f�r eines oder mehrere zeichen zu ber�cksichtigen neben der verwendung von schlagw�rtern stellen die suchbefehle f�r suchbegriffe und synonyme eine m�glichkeit dar um die suche einzugrenzen bei der verwendung von suchbefehlen ist deren schreibweise (syntax) in der jeweiligen fachdatenbank zu beachten}  file       {:1015-2668-1-pbpdf:pdf}  groups     {review 2019-06}  keywords   {lesen hirt}  publisher  {albert-ludwigs-universit�t freiburg}  year       {2019}}```,|| first tests show that copying is fine but pasting alters the encoding via a bibtex parser || i can still reproduce the problem with today `jabref_windows-x64_5_0-dev--snapshot--2019-06-16--master--8d99db113` || the pr is not merged yet you can try the branch version if you like  || it is fixed thanks a lot!**edit**: but wait there is another bug maybe related to this issue here i will test and report**edit2**: the bug #5069 is not related to this issue can be closed if merged || merged this now into master so will be avaiable in a couple of minutes in the master version,1.0,0.0,5043: preserve encoding while copy and pasting in maintable,|| hi stefannice to see some commits from you -)im not sure whether this is not breaking then the parsing from strings in other encodings have you hi checked it with some iso encoded special characters? || iso special characters should be mappable in utf-8 right?! i guess currently the default encoding for copying to the clipboard is utf-8 so pasting with utf-8 made sense to me if we want to preserve the real encoding we probably need to pass the encoding with the dataflavor somehow? like  || we always use utf-8 internally so this makes indeed sense only use case: what if the users has selected a different encoding for the database in the prefs? || > if we want to preserve the real encoding we probably need to pass the encoding with the dataflavor somehow? like  guess we need to do something like this then || this is old swing stuff dont do this it should be sufficient to use the encoding in this method and apply the same encoding when pasting  || i cannot spot any place during serialization where we use an encoding different to the default encoding which seems to be utf-8 then || i dont we need to pay attention to the database encoding since this option only controls the encoding when the database is written to the file (and does not affect the entries in itself) it may be worth a try to use `parserparseentries(new stringreader(entries))` which would circumvent the need to specify an encoding but whether this works depends on if the javafx clipboard is able to correctly encode/decode the string (i tried to dig into the javafx code but it seems that they let the os handle the encoding) otherwise your solution looks good to me,0,0,0,0
5086,1.0,0.0,0.0,1.0,0.0,0.0,0.0,1.0,0.0,0.0,0.0,0.0,0.0,1.0,0.0,0.0,0.0,0.0,0.0,1.0,0.0,0.0,0.0,0.0,0.0,0.0,0.0,bugfix/5045 : modified the existing logic to comply crossref resolution with biblatex specification,5045           ( (         ----  -   -   -  -   () -  ( -   ( []()?),,5045,bugfix/5045 : modified the existing logic to comply crossref resolution with biblatex specification,5045        ( (      because github does not support autolinking there -->-----  change in changelogmd described-  -  manually tested changed features in running jabref-   ()-  (   ( [helpjabreforg](https://githubcom/jabref/helpjabreforg/issues)?),|| thanks for your contribution could you please add a test for the changed code? || @tobiasdiez @siedlerchr sure ill make those amendments and the uts || @tobiasdiez could you please review the latest commit thanks :)  || > looks good to me now> please merge the latest master changes in there have been renaming of the fields classes so you need to fix this then we can merge@siedlerchr i pulled the changes from master this pr can be merged to the master now thanks || > please review the importsfixed and organized imports please review and merge || > > > > please review the imports> > fixed and organized imports please review and mergeplease have a look at travis checkstyle output star imports are not allowedif you use intellij you can directly import the code style from the config folderfor eclipse you can run /gradlew eclipse to automatically import the correct code styleif you then run organize imports in the ide it will be correct || > > > please review the imports> > > > > > fixed and organized imports please review and merge> > please have a look at travis checkstyle output star imports are not allowed> if you use intellij you can directly import the code style from the config folder> for eclipse you can run /gradlew eclipse to automatically import the correct code style> > if you then run organize imports in the ide it will be correctfixed imports issue please review,crossref resolution does not comply with biblatex specification,<!-- note: please use the github issue tracker only for bug reports feature requests questions and general feedback is now handled at  --> **jabref version** > jabref 50-dev--snapshot--2019-06-10--master--eb42850f7> linux 440-150-generic amd64 > java 180_212on> ubuntu 1604-  i have tested the latest development version from  and the problem persists**steps to reproduce the behavior**1 create a *proceedings* entry `foo2019````@proceedings{foo2019  title   {foo conference}  date    {2019}}```2 create an *inproceedings* entry `bar2019` with crossref to `foo2019````@proceedings{bar2019  title   {bar paper}  crossref  {foo2019}}```3 have a look at the `bar2019` row at the main table view**observed behavior**the *year* field of the `bar2019` entry gets populated with the value from the `foo2019` entry**expected behavior**all fileds (esp *year* and *journal/booktitle*) get populated with values obtained from the crossrefed entry**explanation**according to the [biblatex documentation]( (appendix b) the *booktitle* field of an *inprocessings* entry inherits the value from the *title* field of the referenced *proceedings* entry,|| as of now jabref simply takes the value of the same field from the referenced entry these advanced mappings of biblatex are not yet taken into accountthe following code needs to be adapted: || @tobiasdiez ill work on this issue || @tobiasdiez pr  is open for review || thanks to @cyraxsector  this should be fixed now in the latest master  || thanks for your effort unfortunately this does not work for me in the latest master see the [attached mwe]( for testingjabref 50-dev--snapshot--2019-08-26--master--b2e6e8383linux 440-159-generic amd64 java 1104 || thanks to you this should be fixed in the latest development version 😸  could you please check the build from  thanks! please remember to make a backup of your library before trying-out this version,1.0,0.0,bugfix/5045: organized imports,|| please check your imports it seems like you have imported the type from the wrong packagemust be import orgjabrefmodelentrystandardentrytypeand crossref here looks also odd,0,0,0,0
5123,1.0,0.0,0.0,0.0,0.0,1.0,0.0,1.0,0.0,0.0,0.0,0.0,0.0,1.0,1.0,0.0,0.0,0.0,1.0,1.0,0.0,0.0,0.0,0.0,0.0,0.0,0.0,add search for citations in latex files (back-end and gui),here is a **latex parser tool** that reads each file line by line  parses and analyzes them for detecting different citation formats.  its user interface consists of a first dialog box that will **ask the user for a directory** to search tex files. then  the user could **select specific files**. after that  the tool parses these files and **shows all the bibliographic entries found** in a new dialog box.  ![latex_parser](  related issue: 5002](  ----  -   -   -  -   () -  ( -   ( []()?),,5002,add search for citations in latex files (back-end and gui),here is a **latex parser tool** that reads each file line by line parses and analyzes them for detecting different citation formatsits user interface consists of a first dialog box that will **ask the user for a directory** to search tex files then the user could **select specific files** after that the tool parses these files and **shows all the bibliographic entries found** in a new dialog box![latex_parser]( issue: 5002](  change in changelogmd described-  -  manually tested changed features in running jabref-   ()-  (   ( [helpjabreforg](https://githubcom/jabref/helpjabreforg/issues)?),|| thanks a lot!,latex integration,dear jabref users we have accepted one student (@davidemdot) for google summer of code who will be working to improve jabref the topic of his work is to improve the workflow for latex and jabref users for example to import citations from a tex filehe is actively looking for feedback on his use cases and prototype designs of course additional ideas are always welcome as well!http://discoursejabreforg/t/project-latex-integration-please-give-us-your-feedback/1660,|| first of all congratz @davidemdot  if the tex file is related with bib file the solution would become rather complex the workflow would be something like 1 search and find \cite in tex file2 extract the keyword of the related bib entry3 search bibtex file for that keyword and extract the bib entry itself4 list bib entries in jabref main table5 add forward and backward integration for editing bib entriesim nor pro in latex or jabref but always would love to help out in any issues or related workhari || thanks so much @harinda05! i really appreciate your time the workflow that you propose is broadly what it has been planned therefore i am happy to agree with your point of viewwhenever you may have some spare time it would be great if you could have a look at some prototypes please they are shown in this forum thread: particular here is the prototype for finding bibliographic entries:![finding bibliographic entries]( || hi @davidemdot  i tested your additions with my thesis and i found it actually useful 👍 however i found an issue: in the citations search results (and the tab) you show the quoting paragraph in the tooltip as there is no automated linebreak this tooltip becomes very large is there a way to automatically break the paragraph into multiple lines and to shorten long paragraphs into about 5 lines before and after the quotation? long urls probably have to be shortened by force || @calixtushi there!thank you for your quick and positive feedback big point what you commented we will work on it and have a solution as soon as possible![tooltip]( you again! || there is a class called tool tip text util or similar maybe you can add it there || as this is project is now finished and the feature included in the latest development versions ill close this issue feel free to experiment with it and report any problems that you encounter or suggestions for improvement,1.0,0.0,add user interface for the tex parser tool (#5103),,0,0,0,0
5195,1.0,0.0,0.0,1.0,0.0,0.0,0.0,1.0,0.0,0.0,0.0,0.0,0.0,1.0,0.0,0.0,1.0,0.0,1.0,0.0,0.0,0.0,0.0,0.0,0.0,0.0,0.0,add citation commands to texparser,we added a few more citation commands:  autocite    autocite    blockcquote   and  textcquote .  this pr 5194.  ----  -   -   -  -   () -  ( -   ( []()?),,5194,add citation commands to texparser,we added a few more citation commands: `autocite` `autocite` `blockcquote` and `textcquote`this pr 5194-----  change in changelogmd described-  -  manually tested changed features in running jabref-   ()-  (   ( [helpjabreforg](https://githubcom/jabref/helpjabreforg/issues)?),,latex citations search -  missing citations,i tested around the latex citations search feature with my text and found that some citations were not parsedi often used the autocite command   `\autocite{carmody2014}` and also sometimes i used `\blockcquote[p 18]{nelson1999}{blablabla}`tested in current master they were not recognizedthose should be integrated  see also this cheatsheet for a list of other cite commandshttp://tugctanorg/info/biblatex-cheatsheet/biblatex-cheatsheetpdf@davidemdot,,1.0,0.0,add citation commands to texparser: autocite blockcquote and textcquote,,0,0,0,0
5210,1.0,0.0,0.0,0.0,0.0,0.0,0.0,0.0,0.0,0.0,0.0,0.0,0.0,1.0,0.0,0.0,0.0,0.0,1.0,1.0,0.0,0.0,0.0,0.0,0.0,0.0,0.0,fix double paste on different os,4845  fixes #4699  fixes #4836   upon pasting macos calls the system paste as well as jabrefframe.editaction#execute(). this caused a duplicate call of the paste.,,4836,fix double paste on different os,4845 fixes #4699 fixes #4836 upon pasting macos calls the system paste as well as jabrefframeeditaction#execute() this caused a duplicate call of the paste,|| working in linux as well!,pasting text happens twice,steps to reproduce the behavior:1 paste any text into entry editor/search field etc (using ⌘ + v)2 the text is pasted twice does not happen using right-click -> pastejabref 50 dev 85e684b5e6c04c8f47834b3c0a960a9c53d00a3cmac os x 10143 x86_64 java 180_191,|| cannot confirm under windows please try java 8u202 as there have been several bug fixes for mac: || it still persists with latest (18u202) oracle jdk || addon: if an entry is pasted into the maintable it is also pasted twice || reproduced this bug start to work on it  || thanks to @linusdietz  and @stefan-kolb  this issue is now fixed in the latest master!,1.0,0.0,merge remote-tracking branch upstream/master into fix-double-paste* upstream/master:  fix: database mode is always saved as biblatex (#5211),,0,0,0,0
5210,1.0,0.0,0.0,0.0,0.0,0.0,0.0,0.0,0.0,0.0,0.0,0.0,0.0,1.0,0.0,0.0,0.0,0.0,1.0,1.0,0.0,0.0,0.0,0.0,0.0,0.0,0.0,fix double paste on different os,4845  fixes #4699  fixes #4836   upon pasting macos calls the system paste as well as jabrefframe.editaction#execute(). this caused a duplicate call of the paste.,,4845,fix double paste on different os,4845 fixes #4699 fixes #4836 upon pasting macos calls the system paste as well as jabrefframeeditaction#execute() this caused a duplicate call of the paste,|| working in linux as well!,cut and paste duplicates entry in original table,to reproduce 1 open two bibliographies2 copy (command-c) one (or more) entries from first bibliography3 switch to second bibliography and paste with (command-v)then in the entry is added to the second - but also duplicated in the first bibliographyinfo:```jabref 50-dev--snapshot--2019-04-03--master--a273eb1famac os x 10143 x86_64 java 180_191```i think it might be linked with  - also here pasting with right click does not trigger it,|| seems to be only a mac issue on windows 10 i cannot confirm this try updating your java to 8u202 there have been several mac specific fixes || > seems to be only a mac issue on windows 10 i cannot confirm this> try updating your java to 8u202 there have been several mac specific fixesi did the update  however the issue is unaffected || i have a mac os i will investigate it  || @bdcaf  @tobiasdiez  cant reproduce it run jabref via `intellij idea` latest master || thanks to @linusdietz  and @stefan-kolb  this issue is now fixed in the latest master!,1.0,0.0,merge remote-tracking branch upstream/master into fix-double-paste* upstream/master:  fix: database mode is always saved as biblatex (#5211),,0,0,0,0
